,Created Date,Created By,Modified Date,Company,Project,Rating,SubCategory,Associated_feedback,Date,Category,_id,Explanation
0,2024-03-01 10:24:29.731000+00:00,admin_user_feedback-analysis_test,2024-03-01 10:24:29.731000+00:00,1707313014508x102198350946437700,1707329196900x870734705097005300,5,1709253069790x305647624075015900,1707643040311x281208184060071520,2024-02-07 00:00:00+00:00,1709253069102x717430988942903300,1709288669731x792381451006279400,
1,2024-03-01 10:24:29.735000+00:00,admin_user_feedback-analysis_test,2024-03-01 10:24:29.735000+00:00,1707313014508x102198350946437700,1707329196900x870734705097005300,5,1709253063096x594485916638931600,1707643040311x281208184060071520,2024-02-07 00:00:00+00:00,1709253062423x867774813720628500,1709288669735x628249787027423700,
2,2024-03-01 10:24:29.739000+00:00,admin_user_feedback-analysis_test,2024-03-01 10:24:29.739000+00:00,1707313014508x102198350946437700,1707329196900x870734705097005300,5,1709253066544x770991303066428400,1707643040311x281208184060071520,2024-02-07 00:00:00+00:00,1709253065849x444427432726514300,1709288669739x307796151670405300,"La touche Touch ID permet de s'authentifier rapidement et le pavé numérique est très pratique pour la programmation ou les tâches comptables. L'autonomie de la batterie est excellente, et le clavier est léger, ce qui est un avantage pour les déplacements."
3,2024-03-01 10:24:29.741000+00:00,admin_user_feedback-analysis_test,2024-03-01 10:24:29.741000+00:00,1707313014508x102198350946437700,1707329196900x870734705097005300,3,1709253068464x983179727881815700,1707643040311x281208184060071520,2024-02-07 00:00:00+00:00,1709253065849x444427432726514300,1709288669741x932504918890495000,"Le prix est élevé, comme pour tous les produits Apple."
4,2024-03-01 10:24:31.136000+00:00,admin_user_feedback-analysis_test,2024-03-01 10:24:31.136000+00:00,1707313014508x102198350946437700,1707329196900x870734705097005300,5,1709253077078x822788218820358100,1707643040316x844188021545895200,2024-01-31 00:00:00+00:00,1709253075821x830225984700473300,1709288671136x151764047078959840,"La prise en charge de l'installation de la machine, l'ajout de l'anti-calcaire, et la reprise de l'ancienne machine ont été très appréciés. De plus, la ponctualité et l'amabilité du personnel ont été soulignés."
5,2024-03-01 10:24:31.144000+00:00,admin_user_feedback-analysis_test,2024-03-01 10:24:31.144000+00:00,1707313014508x102198350946437700,1707329196900x870734705097005300,5,1709253077786x725798244483031300,1707643040316x844188021545895200,2024-01-31 00:00:00+00:00,1709253075821x830225984700473300,1709288671144x205709792917450940,"Pas de frais de livraison, ce qui a été particulièrement apprécié par le client."
6,2024-03-01 10:24:32.479000+00:00,admin_user_feedback-analysis_test,2024-03-01 10:24:32.479000+00:00,1707313014508x102198350946437700,1707329196900x870734705097005300,5,1709253066544x770991303066428400,1707643040325x374773998880430140,2024-01-05 00:00:00+00:00,1709253065849x444427432726514300,1709288672479x585312490214347400,
7,2024-03-01 10:24:32.484000+00:00,admin_user_feedback-analysis_test,2024-03-01 10:24:32.484000+00:00,1707313014508x102198350946437700,1707329196900x870734705097005300,5,1709253077078x822788218820358100,1707643040325x374773998880430140,2024-01-05 00:00:00+00:00,1709253075821x830225984700473300,1709288672484x986325964377305000,
8,2024-03-01 10:24:33.794000+00:00,admin_user_feedback-analysis_test,2024-03-01 10:24:33.794000+00:00,1707313014508x102198350946437700,1707329196900x870734705097005300,1,1709253064382x227766121950602430,1707643040328x788792274437815600,2023-11-08 00:00:00+00:00,1709253062423x867774813720628500,1709288673794x103782757583408050,Le client a été forcé d'acheter un produit dont il n'avait pas besoin et n'a pas pu obtenir de remboursement malgré une demande légitime.
9,2024-03-01 10:24:33.798000+00:00,admin_user_feedback-analysis_test,2024-03-01 10:24:33.798000+00:00,1707313014508x102198350946437700,1707329196900x870734705097005300,1,1709253065034x409828009667640600,1707643040328x788792274437815600,2023-11-08 00:00:00+00:00,1709253062423x867774813720628500,1709288673798x904262877305823000,
10,2024-03-01 10:24:35.233000+00:00,admin_user_feedback-analysis_test,2024-03-01 10:24:35.233000+00:00,1707313014508x102198350946437700,1707329196900x870734705097005300,1,1709253063096x594485916638931600,1707643040332x631078994865905700,2023-10-06 00:00:00+00:00,1709253062423x867774813720628500,1709288675233x212502084956147870,"Non réponse du magasin à un courrier du client, indiquant un manque d'assistance et d'accueil."
11,2024-03-01 10:24:35.239000+00:00,admin_user_feedback-analysis_test,2024-03-01 10:24:35.239000+00:00,1707313014508x102198350946437700,1707329196900x870734705097005300,1,1709253064382x227766121950602430,1707643040332x631078994865905700,2023-10-06 00:00:00+00:00,1709253062423x867774813720628500,1709288675239x464465700001777340,"Incompétence signalée dans la gestion d'un problème, coûtant 150€ au client."
12,2024-03-01 10:24:35.241000+00:00,admin_user_feedback-analysis_test,2024-03-01 10:24:35.242000+00:00,1707313014508x102198350946437700,1707329196900x870734705097005300,1,1709253065034x409828009667640600,1707643040332x631078994865905700,2023-10-06 00:00:00+00:00,1709253062423x867774813720628500,1709288675241x934718980117046400,
13,2024-03-01 10:24:35.246000+00:00,admin_user_feedback-analysis_test,2024-03-01 10:24:35.246000+00:00,1707313014508x102198350946437700,1707329196900x870734705097005300,1,1709253081642x712745887512628500,1707643040332x631078994865905700,2023-10-06 00:00:00+00:00,1709253079053x541586600770979300,1709288675246x914968081319217400,"Proposition d'un bon d'achat de 20€ en réponse à une perte de 150€, indiquant une politique de remboursement insatisfaisante."
14,2024-03-01 10:24:36.590000+00:00,admin_user_feedback-analysis_test,2024-03-01 10:24:36.590000+00:00,1707313014508x102198350946437700,1707329196900x870734705097005300,1,1709253077078x822788218820358100,1707643040335x335594798547351760,2024-02-07 00:00:00+00:00,1709253075821x830225984700473300,1709288676590x654314243652395300,"Malgré une confirmation de changement d'horaire pour la livraison, le client a reçu un SMS reportant la livraison au lendemain sans respecter l'accord initial."
15,2024-03-01 10:24:38.072000+00:00,admin_user_feedback-analysis_test,2024-03-01 10:24:38.073000+00:00,1707313014508x102198350946437700,1707329196900x870734705097005300,3,1709253069790x305647624075015900,1707643040339x304810172936234940,2023-06-01 00:00:00+00:00,1709253069102x717430988942903300,1709288678072x202350252510430600,
16,2024-03-01 10:24:38.076000+00:00,admin_user_feedback-analysis_test,2024-03-01 10:24:38.076000+00:00,1707313014508x102198350946437700,1707329196900x870734705097005300,5,1709253063096x594485916638931600,1707643040339x304810172936234940,2023-06-01 00:00:00+00:00,1709253062423x867774813720628500,1709288678076x843044102765514900,
17,2024-03-01 10:24:39.493000+00:00,admin_user_feedback-analysis_test,2024-03-01 10:24:39.493000+00:00,1707313014508x102198350946437700,1707329196900x870734705097005300,1,1709253066544x770991303066428400,1707643040342x769644086290685700,2024-02-05 00:00:00+00:00,1709253065849x444427432726514300,1709288679493x451002431351089860,Les appareils achetés ne fonctionnent pas correctement à cause d'une installation inadéquate.
18,2024-03-01 10:24:39.496000+00:00,admin_user_feedback-analysis_test,2024-03-01 10:24:39.496000+00:00,1707313014508x102198350946437700,1707329196900x870734705097005300,1,1709253077078x822788218820358100,1707643040342x769644086290685700,2024-02-05 00:00:00+00:00,1709253075821x830225984700473300,1709288679496x823251222437496300,"Le livreur, un sous-traitant, ne connaissait pas le produit et n'a pas pu réaliser le branchement correctement."
19,2024-03-01 10:24:39.498000+00:00,admin_user_feedback-analysis_test,2024-03-01 10:24:39.498000+00:00,1707313014508x102198350946437700,1707329196900x870734705097005300,1,1709253078419x303428894799921100,1707643040342x769644086290685700,2024-02-05 00:00:00+00:00,1709253075821x830225984700473300,1709288679498x354557417694486600,"Aucune solution proposée par l'entreprise pour résoudre le problème d'installation, forçant le client à trouver et payer un installateur."
20,2024-03-01 10:24:40.849000+00:00,admin_user_feedback-analysis_test,2024-03-01 10:24:40.850000+00:00,1707313014508x102198350946437700,1707329196900x870734705097005300,5,1709253063096x594485916638931600,1707643040351x104699862516092210,2024-02-02 00:00:00+00:00,1709253062423x867774813720628500,1709288680849x486512456596674300,Le vendeur nommé Yousri a été particulièrement apprécié pour son écoute et sa capacité à décrire le produit et apporter satisfaction.
21,2024-03-01 10:24:42.141000+00:00,admin_user_feedback-analysis_test,2024-03-01 10:24:42.141000+00:00,1707313014508x102198350946437700,1707329196900x870734705097005300,4,1709253067173x591291065680345900,1707643040354x847335807238153900,2024-01-19 00:00:00+00:00,1709253065849x444427432726514300,1709288682141x506792121169329340,"Le produit désiré était disponible mais seulement en stock national, ce qui a entraîné un délai de livraison."
22,2024-03-01 10:24:42.145000+00:00,admin_user_feedback-analysis_test,2024-03-01 10:24:42.145000+00:00,1707313014508x102198350946437700,1707329196900x870734705097005300,3,1709253077078x822788218820358100,1707643040354x847335807238153900,2024-01-19 00:00:00+00:00,1709253075821x830225984700473300,1709288682145x502579203256237300,"Le délai de livraison a semblé un peu long au client, bien que les informations sur les délais aient été communiquées clairement."
23,2024-03-01 10:24:42.148000+00:00,admin_user_feedback-analysis_test,2024-03-01 10:24:42.148000+00:00,1707313014508x102198350946437700,1707329196900x870734705097005300,5,1709253066544x770991303066428400,1707643040354x847335807238153900,2024-01-19 00:00:00+00:00,1709253065849x444427432726514300,1709288682148x904569861271267800,"Le client est satisfait de la qualité du produit ONKYO, le trouvant même potentiellement meilleur que le modèle DENON précédent."
24,2024-03-01 10:24:43.445000+00:00,admin_user_feedback-analysis_test,2024-03-01 10:24:43.445000+00:00,1707313014508x102198350946437700,1707329196900x870734705097005300,5,1709253066544x770991303066428400,1707643040357x642043326971186400,2024-01-16 00:00:00+00:00,1709253065849x444427432726514300,1709288683445x696652012469156500,
25,2024-03-01 10:24:44.762000+00:00,admin_user_feedback-analysis_test,2024-03-01 10:24:44.762000+00:00,1707313014508x102198350946437700,1707329196900x870734705097005300,1,1709253066544x770991303066428400,1707643040360x388825069426984100,2024-02-03 00:00:00+00:00,1709253065849x444427432726514300,1709288684762x246605965152930430,"La centrale vapeur a présenté des défauts de fonctionnement au bout de 5 jours, laissant des traînées blanches."
26,2024-03-01 10:24:44.767000+00:00,admin_user_feedback-analysis_test,2024-03-01 10:24:44.767000+00:00,1707313014508x102198350946437700,1707329196900x870734705097005300,2,1709253078419x303428894799921100,1707643040360x388825069426984100,2024-02-03 00:00:00+00:00,1709253075821x830225984700473300,1709288684767x148237474917528350,Le processus de réparation a été lent et sans communication claire sur les délais ou la possibilité d'un dépannage temporaire.
27,2024-03-01 10:24:46.088000+00:00,admin_user_feedback-analysis_test,2024-03-01 10:24:46.088000+00:00,1707313014508x102198350946437700,1707329196900x870734705097005300,5,1709253076447x308401889339217700,1707643040364x965529114330788200,2024-01-15 00:00:00+00:00,1709253075821x830225984700473300,1709288686088x584664099758265700,
28,2024-03-01 10:24:46.090000+00:00,admin_user_feedback-analysis_test,2024-03-01 10:24:46.090000+00:00,1707313014508x102198350946437700,1707329196900x870734705097005300,5,1709253077078x822788218820358100,1707643040364x965529114330788200,2024-01-15 00:00:00+00:00,1709253075821x830225984700473300,1709288686090x926393505526771100,"Livraison gratuite grâce à Darty max, adaptée aux besoins du client ne pouvant pas se déplacer."
29,2024-03-01 10:24:46.094000+00:00,admin_user_feedback-analysis_test,2024-03-01 10:24:46.094000+00:00,1707313014508x102198350946437700,1707329196900x870734705097005300,5,1709253067173x591291065680345900,1707643040364x965529114330788200,2024-01-15 00:00:00+00:00,1709253065849x444427432726514300,1709288686094x992298432965026400,
30,2024-03-01 10:24:46.096000+00:00,admin_user_feedback-analysis_test,2024-03-01 10:24:46.096000+00:00,1707313014508x102198350946437700,1707329196900x870734705097005300,5,1709253068464x983179727881815700,1707643040364x965529114330788200,2024-01-15 00:00:00+00:00,1709253065849x444427432726514300,1709288686096x368466262112663740,"Article à un prix très intéressant, offrant un bon rapport qualité-prix."
31,2024-03-01 10:24:47.381000+00:00,admin_user_feedback-analysis_test,2024-03-01 10:24:47.381000+00:00,1707313014508x102198350946437700,1707329196900x870734705097005300,5,1709253063096x594485916638931600,1707643040367x676032096227942700,2024-01-28 00:00:00+00:00,1709253062423x867774813720628500,1709288687381x413447198636637250,
32,2024-03-01 10:24:48.742000+00:00,admin_user_feedback-analysis_test,2024-03-01 10:24:48.742000+00:00,1707313014508x102198350946437700,1707329196900x870734705097005300,1,1709253064382x227766121950602430,1707643040375x885857715965882800,2024-01-15 00:00:00+00:00,1709253062423x867774813720628500,1709288688742x241887830850478820,"Le client exprime une frustration majeure concernant la résolution de problèmes après-vente, notamment avec un produit vendu comme waterproof qui ne semble pas couvert par la garantie pour des dommages qui devraient être inclus. Des frais de réparation élevés sont demandés malgré la garantie."
33,2024-03-01 10:24:48.745000+00:00,admin_user_feedback-analysis_test,2024-03-01 10:24:48.746000+00:00,1707313014508x102198350946437700,1707329196900x870734705097005300,1,1709253065034x409828009667640600,1707643040375x885857715965882800,2024-01-15 00:00:00+00:00,1709253062423x867774813720628500,1709288688745x522270633297331260,"Le client dénonce un manque de communication de la part de l'entreprise, mentionnant l'absence de réponse aux sollicitations par mail, appel, ou courrier en recommandé."
34,2024-03-01 10:24:48.749000+00:00,admin_user_feedback-analysis_test,2024-03-01 10:24:48.750000+00:00,1707313014508x102198350946437700,1707329196900x870734705097005300,1,1709253078419x303428894799921100,1707643040375x885857715965882800,2024-01-15 00:00:00+00:00,1709253075821x830225984700473300,1709288688749x593353547841914200,"Le commentaire souligne un manque de prise en charge et de professionnalisme dans le service après-vente, notamment en ce qui concerne la gestion de la garantie et des réparations."
35,2024-03-01 10:24:50.315000+00:00,admin_user_feedback-analysis_test,2024-03-01 10:24:50.315000+00:00,1707313014508x102198350946437700,1707329196900x870734705097005300,1,1709253078419x303428894799921100,1707643040379x167772274548541280,2024-02-06 00:00:00+00:00,1709253075821x830225984700473300,1709288690315x715941068133140900,"Le client est baladé entre différents services sans obtenir de solution, malgré les promesses répétées d'une résolution sous 72 heures."
36,2024-03-01 10:24:50.322000+00:00,admin_user_feedback-analysis_test,2024-03-01 10:24:50.322000+00:00,1707313014508x102198350946437700,1707329196900x870734705097005300,2,1709253066544x770991303066428400,1707643040379x167772274548541280,2024-02-06 00:00:00+00:00,1709253065849x444427432726514300,1709288690322x857487541970085600,"Le joint du lave-linge LG se fissure rapidement après l'achat, indiquant une faible qualité du produit."
37,2024-03-01 10:24:51.585000+00:00,admin_user_feedback-analysis_test,2024-03-01 10:24:51.585000+00:00,1707313014508x102198350946437700,1707329196900x870734705097005300,5,1709253064382x227766121950602430,1707643040384x787448504314486800,2024-01-18 00:00:00+00:00,1709253062423x867774813720628500,1709288691585x844968882184129400,Les conseils de Damyan ont permis au client d'économiser de l'argent en réparant un appareil au lieu de le remplacer.
38,2024-03-01 10:24:51.590000+00:00,admin_user_feedback-analysis_test,2024-03-01 10:24:51.590000+00:00,1707313014508x102198350946437700,1707329196900x870734705097005300,5,1709253078419x303428894799921100,1707643040384x787448504314486800,2024-01-18 00:00:00+00:00,1709253075821x830225984700473300,1709288691590x879841027347354000,"Les techniciens ont réparé l'appareil en un temps record, malgré la nécessité de commander une pièce."
39,2024-03-01 10:24:52.963000+00:00,admin_user_feedback-analysis_test,2024-03-01 10:24:52.963000+00:00,1707313014508x102198350946437700,1707329196900x870734705097005300,1,1709253067173x591291065680345900,1707643040388x885470585173043300,2024-02-05 00:00:00+00:00,1709253065849x444427432726514300,1709288692963x671042779592246700,"Un produit vendu par Darty était annoncé comme disponible et après un mois d'attente, le client a été informé par texto de l'indisponibilité du produit au jour de la livraison."
40,2024-03-01 10:24:52.967000+00:00,admin_user_feedback-analysis_test,2024-03-01 10:24:52.967000+00:00,1707313014508x102198350946437700,1707329196900x870734705097005300,1,1709253077078x822788218820358100,1707643040388x885470585173043300,2024-02-05 00:00:00+00:00,1709253075821x830225984700473300,1709288692967x964695514649918300,"Après un mois d'attente pour la livraison, le client a été informé le jour même de l'indisponibilité du produit, remettant en question la fiabilité du processus de livraison."
41,2024-03-01 10:24:54.348000+00:00,admin_user_feedback-analysis_test,2024-03-01 10:24:54.348000+00:00,1707313014508x102198350946437700,1707329196900x870734705097005300,5,1709253063096x594485916638931600,1707643040391x877150136994534500,2024-01-15 00:00:00+00:00,1709253062423x867774813720628500,1709288694348x527128006598498400,
42,2024-03-01 10:24:54.351000+00:00,admin_user_feedback-analysis_test,2024-03-01 10:24:54.351000+00:00,1707313014508x102198350946437700,1707329196900x870734705097005300,5,1709253063739x664374084881986800,1707643040391x877150136994534500,2024-01-15 00:00:00+00:00,1709253062423x867774813720628500,1709288694351x519886426703753100,
43,2024-03-01 10:24:54.354000+00:00,admin_user_feedback-analysis_test,2024-03-01 10:24:54.354000+00:00,1707313014508x102198350946437700,1707329196900x870734705097005300,5,1709253064382x227766121950602430,1707643040391x877150136994534500,2024-01-15 00:00:00+00:00,1709253062423x867774813720628500,1709288694354x929863545999690000,
44,2024-03-01 10:24:55.792000+00:00,admin_user_feedback-analysis_test,2024-03-01 10:24:55.792000+00:00,1707313014508x102198350946437700,1707329196900x870734705097005300,5,1709253066544x770991303066428400,1707643040395x478713205602168300,2024-01-06 00:00:00+00:00,1709253065849x444427432726514300,1709288695792x666733464037269100,
45,2024-03-01 10:24:55.796000+00:00,admin_user_feedback-analysis_test,2024-03-01 10:24:55.796000+00:00,1707313014508x102198350946437700,1707329196900x870734705097005300,3,1709253069790x305647624075015900,1707643040395x478713205602168300,2024-01-06 00:00:00+00:00,1709253069102x717430988942903300,1709288695796x511144987598476350,"L'article était plus cher en magasin que sur le site internet, nécessitant une négociation pour l'alignement des prix."
46,2024-03-01 10:24:57.095000+00:00,admin_user_feedback-analysis_test,2024-03-01 10:24:57.096000+00:00,1707313014508x102198350946437700,1707329196900x870734705097005300,5,1709253063739x664374084881986800,1707643040533x265458187776763460,2024-01-09 00:00:00+00:00,1709253062423x867774813720628500,1709288697095x938112397531112300,
47,2024-03-01 10:24:57.100000+00:00,admin_user_feedback-analysis_test,2024-03-01 10:24:57.100000+00:00,1707313014508x102198350946437700,1707329196900x870734705097005300,5,1709253064382x227766121950602430,1707643040533x265458187776763460,2024-01-09 00:00:00+00:00,1709253062423x867774813720628500,1709288697100x829848738722693800,
48,2024-03-01 10:24:58.501000+00:00,admin_user_feedback-analysis_test,2024-03-01 10:24:58.502000+00:00,1707313014508x102198350946437700,1707329196900x870734705097005300,5,1709253063739x664374084881986800,1707643040538x461977339732764860,2024-01-02 00:00:00+00:00,1709253062423x867774813720628500,1709288698501x667972535200604700,Le client a pu bénéficier d'une promotion sur un produit en rupture de stock grâce à l'intervention du service client.
49,2024-03-01 10:24:58.506000+00:00,admin_user_feedback-analysis_test,2024-03-01 10:24:58.506000+00:00,1707313014508x102198350946437700,1707329196900x870734705097005300,4,1709253067173x591291065680345900,1707643040538x461977339732764860,2024-01-02 00:00:00+00:00,1709253065849x444427432726514300,1709288698506x389144084357912600,
50,2024-03-01 10:24:59.911000+00:00,admin_user_feedback-analysis_test,2024-03-01 10:24:59.911000+00:00,1707313014508x102198350946437700,1707329196900x870734705097005300,1,1709253066544x770991303066428400,1707643040544x122990962313440860,2023-03-30 00:00:00+00:00,1709253065849x444427432726514300,1709288699911x504474157326224830,"Le vendeur achète des marchandises auprès de fournisseurs non vérifiés, ce qui a conduit à des problèmes avec le produit deux mois après l'achat."
51,2024-03-01 10:24:59.919000+00:00,admin_user_feedback-analysis_test,2024-03-01 10:24:59.919000+00:00,1707313014508x102198350946437700,1707329196900x870734705097005300,1,1709253064382x227766121950602430,1707643040544x122990962313440860,2023-03-30 00:00:00+00:00,1709253062423x867774813720628500,1709288699919x161169815570789470,"Le service client n'a pas pu aider de manière satisfaisante lorsque le produit a présenté des problèmes, refusant de remplacer le téléphone malgré l'obligation."
52,2024-03-01 10:25:01.228000+00:00,admin_user_feedback-analysis_test,2024-03-01 10:25:01.228000+00:00,1707313014508x102198350946437700,1707329196900x870734705097005300,5,1709253064382x227766121950602430,1707643040547x391524517599057840,2024-01-18 00:00:00+00:00,1709253062423x867774813720628500,1709288701228x490640217666330240,
53,2024-03-01 10:25:02.624000+00:00,admin_user_feedback-analysis_test,2024-03-01 10:25:02.624000+00:00,1707313014508x102198350946437700,1707329196900x870734705097005300,1,1709253063096x594485916638931600,1707643040556x151808339289971400,2024-02-03 00:00:00+00:00,1709253062423x867774813720628500,1709288702624x758171514133362700,"Des membres du personnel se sont moqués ouvertement des clients, ce qui est inacceptable pour l'image de l'entreprise."
54,2024-03-01 10:25:02.627000+00:00,admin_user_feedback-analysis_test,2024-03-01 10:25:02.627000+00:00,1707313014508x102198350946437700,1707329196900x870734705097005300,3,1709253064382x227766121950602430,1707643040556x151808339289971400,2024-02-03 00:00:00+00:00,1709253062423x867774813720628500,1709288702627x489321366267790000,
55,2024-03-01 10:25:04.016000+00:00,admin_user_feedback-analysis_test,2024-03-01 10:25:04.016000+00:00,1707313014508x102198350946437700,1707329196900x870734705097005300,5,1709253073128x254916530450694400,1707643040562x553339704916105700,2024-02-04 00:00:00+00:00,1709253072455x374665745287587650,1709288704016x257372601081991000,
56,2024-03-01 10:25:04.022000+00:00,admin_user_feedback-analysis_test,2024-03-01 10:25:04.022000+00:00,1707313014508x102198350946437700,1707329196900x870734705097005300,5,1709253071093x572692525423214700,1707643040562x553339704916105700,2024-02-04 00:00:00+00:00,1709253069102x717430988942903300,1709288704022x229956830774502800,
57,2024-03-01 10:25:04.026000+00:00,admin_user_feedback-analysis_test,2024-03-01 10:25:04.026000+00:00,1707313014508x102198350946437700,1707329196900x870734705097005300,5,1709253066544x770991303066428400,1707643040562x553339704916105700,2024-02-04 00:00:00+00:00,1709253065849x444427432726514300,1709288704026x841148200688847500,
58,2024-03-01 10:25:05.394000+00:00,admin_user_feedback-analysis_test,2024-03-01 10:25:05.394000+00:00,1707313014508x102198350946437700,1707329196900x870734705097005300,5,1709253063096x594485916638931600,1707643040568x585702902233997400,2024-01-12 00:00:00+00:00,1709253062423x867774813720628500,1709288705394x426093756762841800,
59,2024-03-01 10:25:05.399000+00:00,admin_user_feedback-analysis_test,2024-03-01 10:25:05.399000+00:00,1707313014508x102198350946437700,1707329196900x870734705097005300,4,1709253066544x770991303066428400,1707643040568x585702902233997400,2024-01-12 00:00:00+00:00,1709253065849x444427432726514300,1709288705399x115906193253358050,le produit fonctionne correctement pour le moment donc rien à dire
60,2024-03-01 10:25:05.506000+00:00,admin_user_feedback-analysis_test,2024-03-01 10:25:05.507000+00:00,1707313014508x102198350946437700,1707329196900x870734705097005300,5,1709253078419x303428894799921100,1707643040568x585702902233997400,2024-01-12 00:00:00+00:00,1709253075821x830225984700473300,1709288705506x502808276277739700,l'explication qui nous a été donnée était honnête et très claire
61,2024-03-01 10:25:06.844000+00:00,admin_user_feedback-analysis_test,2024-03-01 10:25:06.844000+00:00,1707313014508x102198350946437700,1707329196900x870734705097005300,1,1709253067173x591291065680345900,1707643040574x391089037690479600,2024-02-05 00:00:00+00:00,1709253065849x444427432726514300,1709288706844x105472932963655000,Produit indiqué comme disponible lors de la commande mais s'avère indisponible juste avant la livraison.
