Users are having difficulty with the process of reporting hours which is not clear and suggest the possibility of reporting hours monthly rather than weekly.; 1702252405391x688757583568909300; 1702252438992x169278491846565080; No
 Customers are faced with a problem of non-compliance with ordered quantities in terms of personnel.; 1702252410888x136834604643030880;; No
 Clients want regular communication on the actions carried out by the agency, even in the absence of potential candidates.; 1702252418898x891610255546688900; 1702251684358x144572203376458500; No
 The interactions with the student public were very appreciated, with exchanges considered to be of high quality.; 1702252424372x952544572327839600; 1702251795709x628710337044019200; No
 Randstad customers express an unsatisfactory user experience with the online platform, highlighting its lack of intuitiveness and ergonomics, as well as the complexity of document management.; 1702252436805x399850286662872800;; Yes
Customers are demanding simplification and improvement of access and the process of tracking hours worked on the Randstad platform.; 1702252438992x169278491846565080;; Yes
 Customers encounter difficulties in exchanging documents such as contracts, time sheets and invoices on the platform.; 1702252444459x302713339929371970; 1702252436805x399850286662872800; No
 Candidates abandon their positions after the first day, indicating a potential problem with candidate motivation or selection.; 1702252450235x397976821531366600; 1702252313732x762588033293516200; No
 The client proposes the integration of support for training days into the framework agreement.; 1702252463208x669069368732609000; 1702252990790x251380906923327260; No
 The client suffers from punctuality problems of temporary workers which significantly impact operations, particularly when teams travel long distances.; 1702252469256x904939530236718100; 1702252313732x762588033293516200; No
Customers appreciate the pleasantness and helpfulness of the Randstad team, as well as their professionalism.; 1702252483224x568126532943653600; 1702251795709x628710337044019200; No
 Customers express their dissatisfaction with the lack of returns or feedback, and the failure to take their requests into account.; 1702252495769x146384286428548960; 1702251684358x144572203376458500; No
 The client suggests reducing the use of questionnaires and encouraging more frequent live exchanges on site.; 1702252505677x511706989105273660; 1702252540582x933000455127282800; No
 Clients are satisfied with the professionalism of the people met during the interviews.; 1702252510458x386148044159845500; 1702251795709x628710337044019200; No
 Clients express their satisfaction with the rapid understanding of their recruitment needs expressed to Randstad.; 1702252515480x495615452069717800; 1702251787742x986195353747684200; No
 Clients appreciate Randstad's friendliness, professionalism and speed in finding candidates.;1702252520927x700673363549317200; 1702251795709x628710337044019200; No
 Customers experience frustration due to the complete lack of applications and communication after signing a commercial offer.; 1702252531114x535333453771775100; 1702251951781x190649374199281860; No
 Customers are satisfied with Randstad's responsiveness, always responding on time, regardless of the agency contacted.; 1702252537694x451955584294847940; 1702252404706x893472195468355700; No
 Customers want more direct and accessible personal interactions, with simplified communication through a dedicated point of contact and continuously available services.; 1702252540582x933000455127282800;; Yes
 The client had a positive experience during a morning meeting with the candidates, highlighting good cooperation.; 1702252542513x953713237266983400; 1702251787742x986195353747684200; No
 Temporary workers appear to have problems with distraction due to excessive use of cell phones, which affects their engagement and performance at work.;1702252573011x259151622960079870; 1702251592643x358642939349547600; No
 The client wishes to receive more profile proposals for the position of funeral porter.; 1702252580086x420335382771580540; 1702252266394x212466413272064600; No
 The customer appreciates the quality of the overall service, finding it very good and pleasant.; 1702252594381x363193448401509400; 1702251787742x986195353747684200; No
 The client expresses dissatisfaction with the organization of appointments, finding them problematic when scheduled simultaneously.; 1702252596440x109706154185407180; 1702251653260x739912670275253900; No
 Clients are expressing concerns about the efficiency of temporary staff, who appear to take too much time to accomplish little work.; 1702252602248x559175530112230300; 1702252363115x692199679304415000; No
 Clients encounter the problem of a change of temporary worker without being notified in advance by telephone or e-mail.; 1702252606814x899295287168524000; 1702251684358x144572203376458500; No
The client expresses a problem due to an insufficient number of applications received despite a good understanding of the request.; 1702252615633x710285472403005000; 1702251951781x190649374199281860; No
 The client expresses the need for business cards in paper format to compensate for the lack of a professional cell phone.; 1702252629969x280210512695399780; 1702252540582x933000455127282800; No
 The client wishes to receive information on the possibilities of integrating temporary workers and requests follow-up provided by the company.; 1702252636534x298699763862585200; 1702252672236x890675997750774800; No
 It is suggested to create a reminder system for recording the hours of temporary workers.; 1702252645737x155388241350705730; 1702252438992x169278491846565080; No
 The presence of staff from the Molsheim agency is a particularly positive aspect for customers.; 1702252665221x576698375818009100; 1702251795709x628710337044019200; No
The client is generally satisfied with the integration of temporary workers and wishes to both receive information on future missions and benefit from continuous monitoring from Randstad.; 1702252672236x890675997750774800;; Yes
 Customers believe that the services are too expensive compared to the competition without offering additional added value.; 1702252672845x159210339226447680; 1702253667582x240092666822965250; No
 Customers are grateful for the speed of scheduling appointments.; 1702252690989x289705459598551100; 1702252213853x372447263724983200; No
 Customers are satisfied with the relevance of the proposal made to them.; 1702252692913x753792928927437400; 1702252213853x372447263724983200; No
 Clients value the listening and responsiveness of Randstad advisors, as well as their ability to quickly understand client needs.; 1702252697404x171610257815799420; 1702252404706x893472195468355700; No
 Clients are satisfied with the temporary employment offered and the collaboration with Randstad in general.;1702252703320x145076358745642940; 1702252382471x620600853533459700; No
 There is a high turnover rate among advisors which needs to be reduced.; 1702252710430x950949638936389900; 1702252313732x762588033293516200; No
 Clients request at least two annual visits to their site from advisors.; 1702252712192x539576939954203650; 1702251715216x764075287805836300; No
 The client suggests making prior appointments rather than going door to door to interact with them.; 1702252729690x664365736632873000; 1702251715216x764075287805836300; No
 The customer fired a waitress for not complying with the required dress code and because she did not appear to have the skills required for the position.; 1702252749134x874012378790274400;; No
 Clients appreciate personal meetings to discuss recruiting progress.; 1702252756893x288865074827512600; 1702251787742x986195353747684200; No
 Clients are upset by unsolicited visits without appointments set in advance by consultants.; 1702252772148x265614973408623300; 1702252049041x107571055471345820; No
Customers appreciate the excellent quality of service and attentiveness shown by the team.; 1702252787672x310555746559586940; 1702251795709x628710337044019200; No
 Our clients appreciate the attentive management and in-depth understanding of their files by our employees.; 1702252798841x372911488456632260; 1702251795709x628710337044019200; No
 Customers are satisfied with Randstad's responsiveness in setting up missions.; 1702252815836x364130631008745100; 1702252404706x893472195468355700; No
 Clients value effective communication during the recruiting process.; 1702252817734x936703081559140200; 1702252404706x893472195468355700; No
 Customers express high satisfaction without having suggestions for improvement to offer.; 1702252824270x966703140448840800; 1702252382471x620600853533459700; No
 Clients always find dealing with Randstad pleasant, even when they don't have immediate recruitment needs.; 1702252829727x349633583175770200; 1702251795709x628710337044019200; No
Clients express a problem linked to the absence of applications received for their job requests.; 1702252838689x288388113395455100; 1702251951781x190649374199281860; No
 Customers want meetings scheduled in advance to ensure more in-depth discussions.; 1702252850842x708565475740272400; 1702251715216x764075287805836300; No
 Customers are unhappy when satisfaction emails are sent too early in the morning.; 1702252862146x343164867298287200; 1702252897315x988289162925002400; No
 The client suggests communicating offers before the forum for increased visibility.; 1702252875132x778190529145816800; 1702251715216x764075287805836300; No
 Customers appreciate the very good exchanges they have with Randstad.; 1702252892190x583817853112760240; 1702251795709x628710337044019200; No
 Customers are satisfied with the high availability of Randstad.; 1702252893787x239718918725934300; 1702252404706x893472195468355700; No
 Customers are dissatisfied due to a lack of proactive communication and insufficient responsiveness from the company.; 1702252897315x988289162925002400;; Yes
Clients want the temporary workers offered to be interested in long-term commitments.; 1702252911416x281319216300005340; 1702253064012x416978110091254400; No
 The client suggests the creation of an evaluation questionnaire for temporary staff.; 1702252922627x728471754523206000; 1702252257155x634012913116756000; No
 The client finds the weekly billing system complex and painful to manage.; 1702252930458x215048348664471200; 1702252963679x783964162467023500; No
 Customers express a very good impression of the contact with the person in charge of their file at Randstad.; 1702252935475x371972645349372160; 1702251795709x628710337044019200; No
 The client suggests improvement in contract management and billing processes.; 1702252941961x168629495163554740;; No
 The client suggests the organization of new events allowing exchanges between peers.; 1702252949785x360925702250220350;; No
The client wants training in construction professions, including conventional and organizational aspects.; 1702252957811x554265936402334800; 1702252990790x251380906923327260; No
 Clients ask to receive information on the actions taken for recruitment to a given position.; 1702252962963x961640341537598200; 1702252103696x231879594920525020; No
 Randstad customers find administrative monitoring, including weekly invoicing and validation of missions, complex and tedious.; 1702252963679x783964162467023500;; Yes
 Clients are satisfied with the quality of the consultants' intervention.; 1702252968741x556363971017563840; 1702251795709x628710337044019200; No
 Temporary workers interrupt contracts without respecting the required notice period.; 1702252979110x969041838846252900;; No
 The client was satisfied that the appointment met his expectations.; 1702252984827x772037409796326700; 1702251787742x986195353747684200; No
 Customers appreciate the relevance, friendliness and professionalism of the company.; 1702252990756x167196041356292060; 1702251795709x628710337044019200; No
The client is looking for training services, including day support, to improve skills in construction.; 1702252990790x251380906923327260;; Yes
 Clients expect a more in-depth assessment of candidate skills and expectations early in the recruitment process.; 1702253005039x575434173378989200; 1702251951781x190649374199281860; No
 The client requests to arrange a workplace visit and interview with the current worker to better assess the suitability of future talent.; 1702253011485x927793231005979800; 1702253045801x435654440223909950; No
 The customer suggests making an appointment to ensure greater availability.; 1702253020433x504214271091198800; 1702251715216x764075287805836300; No
 The client wants a temporary worker to be hired on a permanent, full-time basis.; 1702253029900x394302313145468350; 1702253064012x416978110091254400; No
 The X team is recognized for being at the top and listening to businesses.; 1702253033964x646727541438205700;; No
The customer appreciates the professional quality of the exchange concerning needs and offers.; 1702253040321x738644902353113900; 1702251787742x986195353747684200; No
 Clients want improved assessment methods, with hands-on testing and skills pre-checks, to ensure talent quality.; 1702253045801x435654440223909950;; Yes
 The client wishes to have a wider choice of profiles in the catering sector.; 1702253050920x410798346148585800;; No
 The quality and excellence of the advisor were highly appreciated by the client.; 1702253057235x972323045654059500; 1702251795709x628710337044019200; No
 The client expresses the desire to hire temporary workers for permanent, full-time positions and wants the profiles proposed to be interested in long-term commitments.; 1702253064012x416978110091254400;; Yes
 The client wants better communication regarding permanent recruitment for executives.; 1702253072552x734187803081926700; 1702251715216x764075287805836300; No
The customer appreciates the company's in-depth knowledge of his expectations.; 1702253095019x790718705824786400; 1702252404706x893472195468355700; No
 Managers or salespeople are perceived as very efficient.; 1702253099936x782126930539299700; 1702251795709x628710337044019200; No
 The customer experienced a positive first interaction when getting to know the organization.; 1702253104288x985773464643187500; 1702251787742x986195353747684200; No
 Clients experience difficulties when temporary workers do not show up to take their jobs.; 1702253113744x830943048947006000; 1702253148297x338538896948932030; No
 Customers are dissatisfied due to lack of communication and feedback after making a service request.; 1702253119557x884703456070247200; 1702252897315x988289162925002400; No
 Customers find the Randstad website not very user-friendly and think it needs improvement.; 1702253124581x689223685639276500; 1702252436805x399850286662872800; No
 Clients are expressing delays in contract management and payment of salaries to temporary workers.;1702253134638x622610631457058300;; No
 Clients express operational difficulties and frustration due to the absence or lack of professionalism of temporary workers, including problems with presentation, hygiene and no-shows.; 1702253148297x338538896948932030;; Yes
 The client suggests contacting the companies to schedule appointments.; 1702253150264x560155280831053500; 1702252103696x231879594920525020; No
 Customers are dissatisfied because their requests are not respected.; 1702253159144x675636267585675300; 1702252897315x988289162925002400; No
 Customers are concerned about privacy issues.; 1702253160984x364528097473830500;; No
 Customers appreciate Randstad’s responsiveness to their requests.; 1702253169024x496224258132672100; 1702252404706x893472195468355700; No
 Temporary workers require additional training or instructions to correctly complete timesheets.; 1702253177148x165969447681494800; 1702251592643x358642939349547600; No
Customers appreciate the professional welcome that meets their expectations.; 1702253183062x344019898629839740; 1702251795709x628710337044019200; No
 Clients express difficulties due to the absence of contact details provided for candidates.; 1702253197229x212708140409488400; 1702251684358x144572203376458500; No
 Customers experience inconvenience when expected visits from company employees do not take place.; 1702253209777x569864860062036400; 1702252897315x988289162925002400; No
 The customer expresses his satisfaction with the efficiency of the Sète agency.; 1702253219819x952217253247805400; 1702251795709x628710337044019200; No
 Clients report that temporary workers do not complete their mission in its entirety.; 1702253226848x980379789584726800; 1702251592643x358642939349547600; No
 Clients express a pain point related to the agency's inability to provide temporary workers available for assignments.; 1702253234549x415852444408164800; 1702251684945x253736720701761120; No
 Customers want to receive fewer emails to access the Randstad portal.;1702253240281x679460934993962900; 1702252436805x399850286662872800; No
 Clients appreciate the pleasantness and professionalism of the temporary workers provided by Randstad.; 1702253248647x848675511660246300; 1702253283331x533219579614774300; No
 The client suggests assessing the level of temporary workers through a skills test before they are hired.; 1702253263430x679913981053907700; 1702252257155x634012913116756000; No
 Customers are frustrated by the need to make an appointment to receive service.; 1702253271098x292178339926623360; 1702252049041x107571055471345820; No
 The client expresses the need to meet candidates in person rather than by videoconference.; 1702253281528x491974015062486300; 1702251715216x764075287805836300; No
 Clients highly value the professionalism and positive personality of the talents provided by Randstad.; 1702253283331x533219579614774300;; Yes
 Customers experience frustration due to no news or follow-up for several days.; 1702253289963x856723409360193700; 1702251684358x144572203376458500; No
Customers appreciate the competence of the staff provided by Randstad.; 1702253294525x760475590165255600; 1702252382471x620600853533459700; No
 Customers suggest implementing a 24-hour service at Randstad.; 1702253303514x762789648575516300; 1702252540582x933000455127282800; No
 Customers are satisfied with the company's responsiveness to their requests.; 1702253311110x373751449470294900; 1702252404706x893472195468355700; No
 The client wishes to receive more unsolicited applications.; 1702253332490x357599541840925000;; No
 The client suggests that communication be done by phone call rather than by email.; 1702253337928x833785507985087500; 1702252540582x933000455127282800; No
 Customers are upset by the need to make an appointment to receive service.; 1702253349464x608936029397317900; 1702252049041x107571055471345820; No
 The client requests that the list of temporary workers be provided sooner.; 1702253358261x847930508767236200; 1702252103696x231879594920525020; No
 Customers appreciate Randstad's attentive presence without it being intrusive.;1702253363419x604567426003208800; 1702252404706x893472195468355700; No
 The client suggests setting up skills checks on candidates before proposing them for missions.; 1702253379473x738957929566637000; 1702253045801x435654440223909950; No
 Satisfaction with the work carried out by the temporary worker is a positive point.; 1702253388699x463729685416180540; 1702253422005x491118154420332700; No
 Clients are satisfied with the work carried out by temporary workers.; 1702253392623x897873369552963100; 1702253422005x491118154420332700; No
 The client values the preparation of the meeting and the relevance of the advice received.; 1702253403285x764093030865201400; 1702251787742x986195353747684200; No
 The client would like appointments to be scheduled in advance before any visit.; 1702253415952x389304087730871740; 1702253449690x342285172891097860; No
 Clients recognize and value the efficiency and quality of the work provided by Randstad temporary workers.; 1702253422005x491118154420332700;; Yes
 Customers appreciate the company's responsiveness in response to their requests.;1702253426969x958780167048609200;; No
 The client highlights a need for improvement in the selection process with more rigorous screening of the proposed candidates.; 1702253434104x414180915996104960; 1702251951781x190649374199281860; No
 The customer appreciates the professionalism and active listening of the company.; 1702253441906x680913440994313200; 1702251795709x628710337044019200; No
 Clients value professionalism and want modular, planned HR services, including an appointment scheduling system.; 1702253449690x342285172891097860;; Yes
 The client wishes to be presented with a greater number of candidate profiles.; 1702253451246x876133822474329300; 1702252266394x212466413272064600; No
 The client suggests having a single contact per company to simplify communication.; 1702253456385x608511083378535400; 1702252540582x933000455127282800; No
 Customers appreciate Randstad's responsiveness and attentiveness.; 1702253480974x736519295283039500; 1702252404706x893472195468355700; No
 Clients express the need to receive CVs that match the profiles they are looking for.;1702253502656x403923288026260000; 1702251951781x190649374199281860; No
 Customers appreciate that their requests are taken into account.; 1702253515428x362795550127054800; 1702252404706x893472195468355700; No
 Clients feel a lack of knowledge of the field of activity when temporary workers are made available.; 1702253527623x509520306049767040; 1702253561513x883729916898281400; No
 Customers appreciate the responsiveness and efficiency of the staff offered by Randstad.; 1702253544371x995374000024076500; 1702251983127x971940715578695000; No
 The client expresses the need for temporary workers with specific knowledge of the profession concerned.; 1702253552900x384480206475967800; 1702253561513x883729916898281400; No
 Customers feel frustrated due to the lack of feedback following their request.; 1702253561288x509299972922338400; 1702251684358x144572203376458500; No
 Clients want temporary workers to have prior expertise in their specific field of work.; 1702253561513x883729916898281400;; Yes
The client appreciated the pleasant personality and volunteerism of the temporary worker.; 1702253581267x479658032340785300; 1702253283331x533219579614774300; No
 Customers are satisfied with the visits as part of commercial procedures.; 1702253593957x374469967859269760; 1702251787742x986195353747684200; No
 Customers appreciate the current quality of services offered by the company.; 1702253605920x624203602679551900; 1702251795709x628710337044019200; No
 The customer appreciated the contact with a specific person mentioned by his initial.; 1702253627681x116322656623690560; 1702251795709x628710337044019200; No
 Customers ask not to have any costs for the mutual insurance company.; 1702253633228x838405134947320000; 1702253667582x240092666822965250; No
 Customers appreciate the efficiency of the service.; 1702253645219x974694596042075300; 1702253422005x491118154420332700; No
 Clients express frustration with the inability to find candidates who match their needs.; 1702253651319x259532753369519740; 1702251951781x190649374199281860; No
 The client expresses a need for increased communication.; 1702253659909x883537218691068500; 1702252897315x988289162925002400; No
Customers believe that Randstad's services, including mutual insurance fees, are perceived as too expensive compared to the competition.; 1702253667582x240092666822965250;; Yes
 Customers express a problem with the lack of offer proposals and follow-up with reminders.; 1702253670160x130124178292349460; 1702251684945x253736720701761120; No
 Clients appreciate the agency's responsiveness.; 1702253679809x281112210522702180; 1702252404706x893472195468355700; No
 Customers want simplified access to the Randstad site.; 1702253690537x610291046123659900; 1702252438992x169278491846565080; No
 Clients appreciate organized meetings.; 1702253696642x287185260702667700; 1702251795709x628710337044019200; No
 Customers are very satisfied with the welcome and follow-up offered by the company.; 1702253707730x533790473331822600; 1702252404706x893472195468355700; No
 The client suggests that the outfits provided to temporary workers be new.; 1702253720866x896738644485770800;; No
 Clients express the need to be notified before Randstad consultants arrive.;1702253736475x947335746997146600; 1702252049041x107571055471345820; No
 The customer reports not having received a visit, potentially suggesting a lack of follow-up or personalized interaction expected in the service.; 1702253744887x989882394299548500; 1702252049041x107571055471345820; No
 Customers express consistent and high satisfaction with the services provided.; 1702253751911x960220857563176500; 1702252382471x620600853533459700; No
 Customers express great satisfaction with the support offered by Randstad.; 1702253764054x185781095497191900; 1702252404706x893472195468355700; No
 There is a need to improve the precision of targeting profiles offered to customers.; 1702253782042x351517529949694400; 1702251951781x190649374199281860; No
 Customers consider the services to be perfect.; 1702253793732x425931161178756160; 1702251795709x628710337044019200; No
 The client expresses the need for a structured appointment scheduling process.; 1702253817827x736417962461429100; 1702252049041x107571055471345820; No
 The client suggests setting up a system for making prior appointments.; 1702253826808x339327706372045440; 1702253449690x342285172891097860; No
The customer requests an increase in responsiveness from the company.; 1702253831703x328452354396274750; 1702252897315x988289162925002400; No
